testID, questionID, MC, POINTS, CORRECT, gptRATE, gptTOPIC,,,,,,,,,,,,,,
22-11-21-D, Q1,,2,1,[3,2,5,2,5,3,5,3,3,3, 3], [3D Geometry, Reflection, Distance Formula],,
22-11-21-D, Q2,,3,1,[4,3,5,3,5,3,5,3,4,4, 3], [Parabolas, Focus, Directrix, Distance Formula],
22-11-21-D, Q3,,3,0,[4,4,5,3,5,3,5,3,4,4, 3], [Ellipses, Tangent Lines, Slope, Geometry, Conic Sections]
22-11-21-D, Q4,,3,1,[4,4,5,3,5,3,5,3,4,4, 3], [Vectors, Dot Product, Geometry, Minimization],
22-11-21-D, Q5,,3,1,[4,4,5,3,5,4,5,3,4,4, 3], [3D Geometry, Angles, Planes, Dot Product, Trigonometry]
22-11-21-D, Q6,,4,0,[5,5,5,4,5,4,5,3,5,4, 4], [Hyperbolas, Geometry, Foci, Tangents, Coordinate Geometry]
22-11-21-D, Q7,,4,0,[5,5,5,4,5,4,5,3,5,4, 4], [Geometry, Trapezoids, Coordinate Geometry, Angles, Distances]
22-11-21-D, Q8,,4,0,[5,5,5,4,5,4,5,3,5,4, 4], [3D Geometry, Regular Tetrahedrons, Spheres, Projections, Tangents]
